name,cuisine,blurb,ZIP,latitude,longitude,avg_USD,stars,bib,assiette,wine,view,garden,outside_dining,air_conditioning,no_dogs,parking,dinner_only,wheelchair,private_dining,with_rooms,booking,lunch_only,dinner_tasting,valet
Soba Totto, Japanese,"It's a jam-packed lunchtime operation here at Soba Totto, where business folks gather and quickly fill the popular space. As the name suggests, everyone arrives in droves for the tasty homemade soba. Dinnertime brings a mellower vibe, and a crowd of beer- and sake-sipping patrons ordering tasty plates of spicy fried chicken and yakitori galore. Midday features several varieties of lunch sets. Tasty appetizers may unveil a salad of assorted pickles and simmered daikon in a sweet ginger dressing. Skip over the fried seafood in favor of the soba totto gozen set, which includes the wonderful soba in fragrant dashi; or try one of the many delicious dons topped with tasty tidbits like sea urchin and salmon roe or soy-marinated tuna, grated yam, and egg.",10035,40.75143,-73.9732,37.0,0,0,0,0,0,0,0,0,0,0,0,1,1,0,0,0,0,0
Madangsui, Korean,"With a menu that reads like a who's who list of Korean all-star dishes, Madangsui is one of those old-school joints that regulars and first-timers seem to enjoy equally well-most likely because when they do any one of their classic Korean dishes, they hit it out of the park. The setting is clean and simple (think Korean barbecue hall) and the staff genuinely warm and friendly, but the lip-smacking roster of classics is the real draw here. Past the lineup of terrific bi bim baps, don't miss the excellent mandu, fried to perfection and piped with tender pork and vegetables; or japchae, a sweet potato noodle stir fry; or one of the restaurant's increasingly popular lunch specials-imagine a refreshing bowl of naengmyeon served in icy cold broth.",10018,40.74999,-73.98549,37.0,0,0,0,0,0,0,0,0,0,0,0,1,0,0,0,0,0,0
Oceana, Seafood,"A more apposite name would be hard to imagine and that's not just because this restaurant serves the bounty of the sea; it also stretches out as far as the eye can see. Get a table in the far corner and you may feel you've sailed to distant shores, while the sheer scale of the room may leave you feeling mildly Lilliputian. Come during the day and you'll witness Corporate America at lunch-and they clearly appreciate the efficiency with which it's run. The menu offers enough choice to satisfy the most demanding of sea dogs: there are oysters and lobsters, classics and more contemporary offerings; there are dishes for two like salt-baked mackerel or paella and, for those who fancy themselves as hunter-gatherers, whole fish.",10019,40.7592,-73.98149,62.0,0,0,0,1,0,0,1,0,0,0,0,0,1,0,0,0,0,0
Radiance Tea House, Asian,"Radiance Tea House is a delicious midtown curiosity. The ordinary locale obscures its presence, but one step inside reveals an unexpected world of green tea and tranquility. Walls are shelved with books about tea and wellness to peruse or purchase, as well as a selection of tea tins and ceramic ware. Arrive during the lunchtime peak and the scent of rice wine vinegar wafts through the air from tables loaded with dumplings and dipping sauce. A vast selection of loose-leaf blends is offered to be enjoyed alongside chicken wontons with house-made chili oil, green tea soba noodles with sesame sauce, and shrimp-stuffed baby bok choy. Tea lovers note that a traditional Chinese tea ceremony can be booked one day in advance for a minimum of two persons.",10019,40.76401,-73.98089,37.0,0,0,0,0,0,0,0,0,0,0,0,0,0,0,0,0,0,0
Brinkley's, Gastropub,"Brinkley's seems to be the provincial ""pub"" for everyone from students and hipsters to executives looking for a thirst quencher and bite after work. This easy and informal spot wears a boho-chic look with metallic stools lining a zinc-topped bar, a black-and-white checked floor, and burgundy leather booths. The team fits the casual, neighborhood feel of its vibrant yet rather noisy surroundings.Find such straightforward delights as a grilled chicken salad with walnuts, grapes, and red onion in a shallot vinaigrette. Then, move on to a deliciously crusty lobster club filled with bacon and avocado, served with sweet potato fries. A taste of their moist bread pudding topped with whipped cream will ensure some very simple, homespun bliss.",10012,40.72115,-73.99781,37.0,0,0,0,0,0,0,0,0,0,0,0,0,0,0,0,0,0,0
Caravaggio, Italian,"Nestled among Madison Avenue boutiques and commanding a rather formal air, this highbrow Italian dining room is a good reason to dress up and splurge. The slender setting is adorned with silk-lined walls, sleek leather seating, and evocative artwork. The well-dressed staff is serious, but their hospitality is genuine. The team of highly experienced co-chefs is equally intense in turning out their skilled cooking. Antipasti might include an elegant, warm octopus salad with baby artichoke and crispy potatoes, while heartier options may feature house-made cavatelli with jumbo crabmeat and sea urchin. Lunch offers a more pared-down experience, but a bowlful of velvety pasta e fagioli stocked with plump borlotti beans is a perfect post-shopping tonic.",10021,40.77349,-73.96469,62.0,0,0,0,0,0,0,0,0,0,0,0,1,1,0,0,0,0,0
Community Food & Juice, American,"As part of Columbia University's sprawl, this address is a godsend for students, faculty, and locals from morning to night. Although it's spacious with plenty of outdoor options, the popular spot doesn't accept reservations-and has the lines to prove it. Executive Chef/partner Neil Kleinberg (also of downtown fave Clinton St. Baking Company) turns out joyful fare, and the weekly blueberry pancake special is just one reason why this place gets so much love. For lunch, a kale salad with artichoke hearts, pickled carrots, and crispy chickpeas is anything but rote. Come dinnertime, the fish or steak of the day has revealed pan-seared mahi-mahi with roasted cauliflower and black truffle beurre blanc, or grilled strip steak brushed with glistening teriyaki.",10115,40.80611,-73.96565,37.0,0,0,0,0,0,0,1,0,0,0,0,1,0,0,0,0,0,0
Taqueria Tlaxcalli, Mexican,"What this sweet little Mexican spot lacks in looks it makes up for in personality-plus a warm, inviting atmosphere that draws a constant stream of locals. Behind the counter, a smiling staff prepares each order with machine gun speed, and professional servers are quick to help anyone not fluent in Spanish. Daily specials could include anything from a complex mole to slow-braised goat with broth, though the menu is rife with options. Begin with a torta, stuffed with steak, layers of beans, avocado, onions, lettuce, and a bright chipotle mayo. In the molcajetes, grilled cactus strips, Mexican sausage, and tortillas are sautéed and then buried under a spicy green sauce and sprinkled with queso. A nice end is found in a cool disk of coconut flan.",10462,40.83631,-73.85489,18.5,0,0,0,0,0,0,0,0,0,0,0,0,0,0,0,0,0,0
El Almacen, Argentinian,"This Argentinian grill is a carnivore's delight with its menu of meaty entrées from the grill (de la parrilla) like the parrillada featuring hearty ribeye and chorizo with truffle fries; or the ""kitchen"" offerings (de la cocina) which might include malbec-braised short ribs with sweet potato purée and Brussels sprouts. These hearty creations are best followed by dulce de leche in one of its several guises. El Almacen, which means general store in Spanish, boasts a dark, rustic, and atmospheric setting replete with creaking wood furnishings, shelves of bric-a-brac, and cast iron skillets mounted on a brick wall. The bar is inviting, amply stocked with wine bottles, and set against a backdrop of creamy white tiles warmed by the candlelit room.",11211,40.7167,-73.9564,37.0,0,0,0,0,0,0,1,0,0,0,0,0,0,0,0,0,0,0
East Harbor Seafood Palace, Chinese,"Dim sum is a well-orchestrated dance at this boisterous hall, where small crowds wait for a spot at one of the large round tables for an indulgent weekend brunch. Steaming carts roll by and waiters ferry trays briskly into the red dining room with shiny gold accents. Service is quick but helpful; the constant clatter of chopsticks and rollicking groups are part of the fun. Eyes can guide the ordering when it comes to the dim sum carts, stocked with authentically prepared bites. Try the plump shrimp siu mai followed by rice noodles wrapped around crunchy whole shrimp and doused in a salty-sweet soy sauce. Snappy, stir-fried green beans are addictively crunchy. Don't miss the Singapore mei fun, a mound of vermicelli noodles with shrimp, pork, and scallions.",11220,40.63343,-74.01442,37.0,0,1,0,0,0,0,0,0,0,0,0,1,1,0,0,0,0,0
Fonda, Mexican,"A lively retreat set in a quiet neighborhood, Fonda is a local darling for creative Mexican food. Tiny tables are tightly packed into the dim room, where blood-red walls, a black ceiling, and paintings hanging over exposed brick create an intimate feel. Metal fans spin overhead and soft Mexican tunes are almost drowned out by animated conversations. Looking for tacos? Go elsewhere. This menu is more nuanced with such appetizing items as duck zarape, a mound of tender, shredded duck between warm, flaky tortillas and blanketed in a roasted tomato-habanero sauce. Pescado en chile atole is equally layered with flavor, featuring ancho-rubbed red snapper over creamy fingerling potatoes and tender poblanos. Outposts also reside in Chelsea and the East Village.",11215,40.66368,-73.98461,37.0,0,0,0,0,0,0,1,0,0,0,0,0,0,0,0,0,0,0
Juventino, Contemporary,"A lovely storefront opens into this airy restaurant with distressed wood details and whitewashed walls lending a rustic farmhouse vibe. Tables are lined with pages from old cookbooks and the walls have vintage mirrors and shelves stocked with an impressive selection of cookbooks. This Latin-influenced neighborhood spot also has a seasonal back patio for alfresco dining. Daily brunch makes the most of the bright, sunny eggs that enhance many dishes, especially the lush yolks that ooze into the herbaceous pumpkin seed mole over potato hash with thinly sliced chunks of tender lengua. A deliciously chewy grain salad popping with quinoa, barley, and tender beluga lentils in a tart, lemony vinaigrette is a healthy, tasty pick-and an easy favorite.",11215,40.67147,-73.98466,37.0,0,0,0,0,0,0,1,0,0,0,0,1,0,0,0,0,0,0
Mimi's Hummus, Mediterranean,"Think meze and you have the right idea behind this heavenly destination for extra-delicious hummus. Though the space is teeny-tiny, a wise, thoughtful design and large windows ferrying swaths of natural light into the dining room make it very inviting. The open kitchen encourages a cheerful vibe and plenty of playful banter between the warm staff and upbeat patrons. Oven-hot pitas arrive ready for scooping up the rich, creamy hummus (a mix of chickpeas, tahini, onion, and cumin). A variety of garnishes are also available, including meaty mushrooms, which are a worthy companion to the silky signature dish. Pickles are a necessary side with an Iraqi sandwich stuffed with hardboiled egg, fried eggplant slices, boiled potato...and yes...more hummus.",11218,40.64031,-73.96688,18.5,0,0,0,0,0,0,0,0,0,0,0,0,0,0,0,0,0,0
Miranda, Fusion,"The cuisines of Latin America and Italy join for a splendid union at this Williamsburg trattoria, run by husband-wife team Sasha and Mauricio Miranda. The pretty space is illuminated with jewel-toned votives and boasts a cement floor inlaid with oak, straw seat chairs, and exposed brick. Beyond this, the chef puts her impressive experience to work in the open kitchen. The house-made pappardelle is a perfect example of Miranda's unique approach: the wide delicate strands of pasta clutch on to bits of slow-cooked lamb in a dark, earthy, mole tasting of dried chilies, sweet spices, and bitter chocolate. Other items may include grilled baby octopus with avocado and jalapeño, or roasted pork tenderloin with tomato and cumin-scented Arborio rice.",11249,40.71996,-73.95784,37.0,0,0,0,0,0,0,0,0,0,0,0,0,0,0,0,0,0,0
Tanoreen, Middle Eastern,"One of the city's finest Middle Eastern experiences is tucked into an unassuming Bay Ridge corner and run by Chef/owner Rawia Bishara and her daughter. Meals graciously commence with pickled vegetables and za'atar-dusted flatbread and are followed by a tableful of unique plates brimming with flavors and colors. Turkish salad is actually a bright red tomato spread shot with harissa and dressed with bits of diced cucumber and a drizzle of excellent olive oil. Appetizers are numerous, but try to fit in the chicken fetti: an entrée of basmati rice pilaf studded with toasted, broken vermicelli and topped with spicy bits of chicken, slivered toasted almonds, a generous drizzle of yogurt-tahini sauce, and chopped parsley for a fresh, final note.",11209,40.6309,-74.02772,37.0,0,1,0,0,0,0,0,0,0,0,0,1,0,0,0,0,0,0
Umi NOM, Asian,"Discerning Pratt students likely inspired the team behind Umi NOM, a fun and adventurous area standout. Outfitted in wood paneling and pew-like benches, the narrow space incorporates intriguing design elements and bamboo ornaments to keep the eyes as pleased as the palate-and rises well above the typical takeout joints that line this unremarkable block. The lack of a liquor license is all but forgotten with a sip of the thirst-quenching calamansi juice to pair with fusion tacos stuffed with strips of pig's ear, pickled onions, smoked spicy salsa, and more. Don't miss the pad krapow made with ground beef, long beans, Thai chilies, and clove-like holy basil. Pork belly adobo, braised for three hours in coconut milk and spices, is a thing of beauty.",11205,40.69062,-73.95997,37.0,0,1,0,0,0,0,1,0,0,0,0,0,0,0,0,0,0,0
Imperial Palace, Chinese,"You might mistake Imperial Palace for one of those red awning-covered restaurants on this strip of Chinese eateries-but don't. While it may share the same lettered signage, wide windows, and nondescript facade, inside find some of the best sticky rice and Dungeness crab Flushing has to offer. Seafood is front and center, with servers promptly presenting everything from deep-fried jumbo shrimp tossed with candied sesame walnuts to shrimp-stuffed tofu with slices of conch. It's easy to plow through all the fresh shellfish dishes with a chilled beer and sweet rice, but try to leave room for the clam casserole: a spicy broth full of Cantonese flavors, loads of onions, and small, briny clams, finished with a sprinkling of crisp coriander stems.",11354,40.76196,-73.83062,37.0,0,0,0,0,0,0,0,0,0,0,0,0,0,0,0,0,0,0
Little Pepper, Chinese,"Set on an ordinary block of residences and businesses is Little Pepper, a tiny yet extraordinary rendition of Sichuan cooking. The room wears a delicate vibe with hand-painted murals, marble-tiled floors, and a cozy service bar. But, the real focus remains on the food, which is honest, bold, and always on-point. Sample soft and yielding mapo tofu, sweet with minced pork, fiery with chilies, and smoky with ground peppercorns sinking into a thick, oily gravy; or shredded pork tossed with potato strands and pickled cabbage to truly appreciate their excellent (if occasionally) underrated food. Pine nuts sautéed with corn and snow pea leaves are marvelous for mellow palates, while chicken stir-fried with dried red chilies is a hit among those on a spice trip.",11356,40.78249,-73.84613,18.5,0,1,0,0,0,0,0,0,0,0,0,1,0,0,0,0,0,0
Main Street Imperial Taiwanese Gourmet, Chinese,"It's a real journey to this Taiwanese treasure-not only in its trek from the closest subway stop, but more importantly, in the experience. Here, the staff speaks their mother tongue for the most part, incense wafts from an altar, and the food is otherworldly. Dishes present dazzling, authentic flavors, easily savored in the peaceful atmosphere. Sweet, head-on shrimp arrive steamed and still in the shell, housing juice that accentuates the concentrated flavor when dipped in soy sauce. Likewise, the stinky tofu (a traditional delicacy) gets its flavor from a light sauté and a finish of kimchi-style pickles. And if you're any sort of fan of the famed oyster pancake, this outstanding version will remain in your memory long after the lengthy ride home.",11355,40.74357,-73.82591,18.5,0,0,0,0,0,0,0,0,0,0,0,0,0,0,0,0,0,0
Sik Gaek, Korean,"There may be glitzier Korean spots in town, but insanely delicious, exceedingly simple Sik Gaek assures a good time, every time. Dressed in silly costumes, the staff is always having a blast in this seasonally decorated shack-like dining room featuring corrugated metal roofs, street lights, buckets for shells, and walls papered in dollar bills. Booths along the edge are filled with noisy regulars. The kitchen serves the ocean's bounty, starting with a deliciously crisp and gargantuan pancake, pajeon, studded with seafood and kimchi begging to be dipped in enticingly salty soy-sesame sauce. A cloudy soup bobbing with tofu arrives piping hot, boasting that sharp, nutty, telltale flavor of fermented bean curd, and seems to have its own restorative powers.",11358,40.76272,-73.80388,37.0,0,0,0,0,0,0,0,0,0,1,0,1,0,0,0,0,0,1
Taiwanese Gourmet, Chinese,"A truly local spot, Taiwanese Gourmet puts diners in the mood with its semi-open kitchen (a rarity for Chinese restaurants) and tasty food. Natural light floods the walls, which showcase an impressive collection of ancient warrior gear, all beautifully framed as if museum-ready. Menu descriptions are minimal but the staff is happy to elaborate. Excellent technique shines through the Taiwanese specialties, notably in strips of ""shredded beef"" sautéed in a dark, meaty paste, and tossed with dried tofu that balances complex flavors with fresh Chinese celery-a hands down winner on the menu. Likewise, the stir-fry of wonderfully briny clams and basil offers a perfect balance of sweet and salty flavors with oyster sauce, soy, rice wine, and red chilies.",11373,40.73978,-73.87867,18.5,0,0,0,0,0,0,0,0,0,0,0,0,0,0,0,0,0,0
ABC Kitchen, Contemporary,"Chef Jean-Georges Vongerichten's signature dining chez ABC Carpet and Home began at this rustic yet glossy farm-to-table venue. A hit since opening, the room is an absolute scene. The pretty people are almost as pretty as the room. Service never impresses, but that is of little importance to this gregarious gaggle of devotees. Tables are accented with flowers and soy-based candles, which cast a glow on each plate. Expect the fresh flavors of ruby-red line-caught tuna sashimi marinated in ginger-soy sauce, sparked by fresh mint and red chili. Bowtie pasta with kasha and veal meatballs slicked with reduced, herb-infused jus is a hearty treat. Desserts may elicit cheers, especially the creamsicle tart-an orange-infused rendition of gâteau Basque.",10003,40.73775,-73.98953,37.0,0,0,0,0,0,0,0,0,0,0,0,1,0,0,0,0,0,0
Maialino, Italian,"Maialino is a trattoria, but only in theory. As the dining room of the Gramercy Park Hotel designed by the Rockwell Group, and overseen by service maestro Danny Meyer, there's nothing rustic or humble about it. The setting buzzes from day to night, and has established itself as a preferred watering hole for every sort of influencer. Chef Nick Anderer's menu of Roman-inspired delights brings the upscale scene down to earth with an assortment of hearty preparations, like unctuous honeycomb trippa alla Trastaverina braised in a spicy tomato sauce. Enticing pastas include fat tubes of paccheri dressed with silky white beans, pleasantly bitter escarole, and a touch of rosemary. Come dessert, the curiously light ricotta-based panna cotta cannot be missed.",10010,40.73853,-73.98578,37.0,0,0,0,0,0,0,0,0,0,0,0,1,1,0,0,0,0,0
Laut, Asian,"Laut is a unique Malaysian restaurant that is at once cheerful and authentic yet never challenging or inaccessible. It is likewise true to its downtown spirit, in a room that features dim lighting and exposed brick prettied with chalk drawings of orchids and water lilies. The personable staff and menu of Southeast Asian delights are as steady as the constant crowd. Popular choices include roti telur, a thin and slightly crisped yet pliable pancake stuffed with scrambled eggs, onions, and peppers, paired with fragrant chicken curry and coconut dipping sauce. The nasi lemak is a dome of coconut rice surrounded with sweet chili shrimp, hard-boiled egg, roasted peanuts, and dried anchovies for mixing into an outrageously good mélange of Malaysian flavors.",10003,40.73768,-73.99101,37.0,0,1,0,0,0,0,0,0,0,0,0,0,0,0,0,0,0,0
Tamba, Indian,"Tamba's food may be very good, but the genuine hospitality delivered by owner Mr. Malik and his team of servers is memorable. These are the touches that set it well above its Curry Hill brethren. Billed as an Indian grill, many dishes are char-kissed and arrive fresh from the tandoor like succulent jalpari (jumbo shrimp); mint paneer tikka; or haryali kebab, skewered chunks of white meat chicken marinated in an herbaceous coriander-mint purée served over a bed of salad greens and browned onions. Other favorites include channa saag, toothsome chickpeas and finely chopped spinach simmered in onion, tomato, ginger, and fragrant spices. Tamba's special naan is studded with bits of tandoori chicken and is a delicious complement to everything on the menu.",10016,40.74219,-73.98247,37.0,0,0,0,0,0,0,0,0,0,0,0,0,0,0,0,0,0,0
Recette, Contemporary,"A consummate pleaser, this corner restaurant mimics the character of the neighborhood-intimate, quaint, and sophisticated. Inside and out, a buzzy vibe seems to extend from the semi-open kitchen to the small bar. Service is genuine and warm; decorative mirrors make the most of the diminutive space, accented with tall wood-framed windows. Dishes are inventive, often deliciously riffing on the familiar. For a fun twist on wings, try the crispy, soft-centered ""Buffalo"" sweetbreads with a blue di bufala dip and pickled celery. Raw snapper is topped with grated bottarga and pickled onion, served alongside crispy oyster fritters. Heartier dishes include fresh-cut spaghetti with sweet shrimp, tomato, chili, and sea urchin or venison loin-stuffed cabbage.",10014,40.7374,-74.00673,62.0,0,0,0,0,0,0,0,0,0,0,0,0,0,0,0,0,0,0
Mapo Tofu, Chinese,"""How many?"" That's the greeting at this temple of ""ma la,"" where enticing aromas are sure to lure you in. Find yourself among executives and locals slurping up a host of chili oil specialties (don't wear white!). This is the kind of place where dragons go to recharge their breath. Some may peruse the menu-rife with typos-for daily specials, but most blaze their tongues with Sichuan pickles or chilled noodles tossed in an intense sesame vinaigrette. The place is named after a humble dish, but many items surprise with bold flavors like silky fish fillets swimming in a spicy broth with Napa cabbage, or camphor tea-smoked duck. Peppercorns in stir-fried chicken unite subtle sweetness with intense heat, while sponge squash offers a cooling, textural finale.",10016,40.75001,-73.97735,18.5,0,1,0,0,0,0,0,0,0,0,0,0,0,0,0,0,0,0
Print, American,"Travel to these western hinterlands and breath a whiff of Californian sensibility. Print's home, off the lobby of the Ink48 hotel, has an easy-breezy layout that unites lounging and supping in a space that is pleasantly moody and particularly cozy. The talented team behind this locavore kitchen takes its mission seriously: there is a full time forager on payroll, water is poured into recycled glasses, the kitchen composts, and the menu highlights the provenance of ingredients. Seasonality and simplicity are shown in creations like a wintertime salad of watercress, blood orange, Medjool dates, crushed Marcona almonds, and sherry vinaigrette. During the summer, ride up to the 16th-floor Press lounge for drinks, small plates, and killer views.",10019,40.76461,-73.99558,37.0,0,0,0,0,0,0,0,0,0,0,0,1,0,0,0,0,0,0
Andre's Café, Eastern European,"A glass case displaying a decadent selection of traditional pastries-everything from savory meat pies to apple strudel and Sachertorte-greets and tempts guests entering this charming Hungarian café. Purchase something to-go, or take a seat at one of the small wooden tables in the brick-walled, knickknack-filled dining room and peruse the menu. Standouts include a crisp cucumber salad, marinated in slightly sweetened vinegar and served ice-cold, and meaty stuffed cabbage, braised until silken and rustically presented in a pool of paprika-infused tomato broth. For dessert, tuck into the Dobos torte, a tall stack of yellow sponge cake and chocolate buttercream topped with a thick layer of crunchy, amber-tinged caramel embedded with a whole hazelnut.",10028,40.77705,-73.95268,18.5,0,0,0,0,0,0,0,0,0,0,0,0,0,0,0,0,0,0
Purple Yam, Asian,"Filipino food authorities Amy Besa and Romy Dorotan serve up a deliciously freewheeling array of Southeast Asian treats at this inviting café, named for their homeland's adored tuber. Located in lovely Ditmas Park, a neighborhood extoled for its Victorian homes, the interior charms with soothing colors and a view of the kitchen at work. Filipino favorites abound, as in chicken adobo-the bone-in pieces are browned and braised in a complex-tasting sauce of coconut sap vinegar, coconut milk, and soy sauce. Standouts might include pancit bihon made with rice vermicelli stir-fried with roast pork, bok choy, and bean sprouts. Other tasty options depart from the Philippines, such as sweetly spiced goat curry with fresh mango chutney.",11226,40.64047,-73.96565,37.0,0,1,0,0,0,0,1,0,0,0,0,1,0,0,0,0,0,0
