name,cuisine,blurb,ZIP,latitude,longitude,avg_USD,stars,bib,assiette,wine,view,garden,outside_dining,air_conditioning,no_dogs,parking,dinner_only,wheelchair,private_dining,with_rooms,booking,lunch_only,dinner_tasting,valet
Joe & MissesDoe, Contemporary,"Chef Joe and Jill Doe have revamped their earnest establishment with a tweaked menu and pared down interior look. Gone are the knickknacks that were previously sprinkled throughout this small room, which now seats about 30 at a single row of tables and long bar counter. From his station in the open kitchen, the chef gives American cuisine a creative re-working. Broccoli meets skordalia in an appetizer of caramelized florets dressed with grated pecorino, sliced almonds, pistachios, and toasted garlic. Beef brisket is slow-braised then griddled, and plated with house-made steak sauce and spicy radish chow-chow. A sundae of chocolate chip banana bread with vanilla ice cream and bananas Foster sauce is yet another example of this enjoyable hybrid cuisine.",10003,40.72379,-73.98969,37.0,0,0,0,0,0,0,0,0,0,0,0,0,0,0,0,0,0,0
East 12th Osteria, Italian,"On the one hand, this is a straightforward little corner trattoria. On the other, Chef Roberto Deiaco's exciting cooking is a delicious presentation of Italian tastes and technique. The front of house is run by the chef's wife, who lends a personal and intimate air that's hard to fake and increasingly rare. The room glows with good vibes that radiate across the hardwood floor, marble bar, and tin ceiling. Contemporary highlights accent the Northern Italian-focused menu of fritto di mare neatly piling hot and delicately crisp calamari, red mullet, jumbo shrimp and a zucchini blossom. Tagliolini all'uovo is twirled with basil pesto, ricotta salata, and black truffle; and slowly braised veal cheeks are coddled with pinot bianco gremolata sauce and polenta.",10003,40.73014,-73.98358,37.0,0,0,0,0,0,0,0,0,0,0,0,0,0,0,0,0,0,0
Pagani, Italian,"With witty cocktails, cured meats, and rustico nuovo décor, Pagani brings an extra dose of Italian charm to Bleecker Street, and a good one at that. Flauting a vibrant scene of locals guzzling indigenous Italian wines and Averna-steeped drinks, this brainchild of Massimo Lusardi targets a younger brood where authenticity and creativity go hand-in-hand. His family may own several other restaurants, but sizeable portions of house-made pasta with updated embellishments (think: montasio cheese topping a decadent ragù of veal and pork) highlight balance and excellence. Just as veal shoulder arrives unbelievably fragrant and tender with herb-rubbed, toasted bread; rigatoni with braised rabbit and sweet carrots feel like a match made in culinary heaven.",10014,40.732143,-74.00348,37.0,0,0,0,0,0,0,0,0,0,0,0,1,0,0,0,0,0,0
Armani Ristorante, Italian,"At Giorgio Armani's Fifth Avenue restaurant what you're wearing is as important as what you're eating. Overlooking the famous street, models serve as (distracted) staff members and bartenders are pure showstoppers-to no one's surprise. Would you expect anything less of the man whose luxurious Armani Casa furniture lines the space? His streamlined and modern aesthetic prevails, right down to the glistening, ruby-red tuna tartare. Each cube cut by hand, the sea-fresh fish rolls in truffle oil and chives with briny sea beans and trout roe for a fantastic play on texture. Equally precise, the pan-seared spring flounder is infused with a coriander reduction, fresh porcini, and fennel with an airy foam that looks so good it may as well be Photoshopped.",10022,40.762127,-73.974144,62.0,0,0,0,0,0,0,0,0,0,0,0,1,0,0,0,0,0,0
Emilio's Ballato, Italian,"This unassuming Houston St. standard is an unsung hero, even if many walk past Emilio's gold- and red-etched window and write it off as some run-of-the-mill red sauce joint. Step inside the narrow, weathered space, where owner Emilio Vitolo offers each guest a personal welcome and a genuine Italian-American experience. The menu is filled with pasta classics like Roman cacio e pepe, tossed with sharp pecorino cheese and freshly ground black pepper. Signature specialties include pollo Emilio, a delicately breaded chicken cutlet draped in lemon-caper sauce; and plump clams oreganata speckled with garlicky breadcrumbs. Crisp cannoli shells filled with vanilla- and cinnamon-tinged ricotta cream rival any other version found from Palermo to Siracusa.",10012,40.72462,-73.99447,37.0,0,0,0,0,0,0,0,0,0,0,0,0,1,0,0,0,0,0
Khe-Yo, Asian,"This Laotian hot spot serves up vibrant family-style plates brimming with tart and spicy notes that pack a punch-make that a Bang Bang, actually, as in the house sauce of mixed chilies, cilantro, fish sauce, and garlic served to diners as a welcome along with a basket of sticky rice. The food is worth braving the wait and decibel levels, so sip a craft brew or cocktail before digging in. Start with a plate of wide rice noodles and bits of slow-cooked pork in a coconut-rich yellow curry garnished with herbs, bean sprouts, and slivered banana blossom. Banana leaf-steamed red snapper is another beautifully prepared item, served with crisped artichoke hearts, Chinese broccoli, and more of that sauce. Bright and bitter grapefruit sorbet is a fitting finish.",10013,40.716835,-74.00879,37.0,0,1,0,0,0,0,0,0,0,0,0,0,0,0,0,0,0,0
Atrium, Contemporary,"This industrial bi-level space has a rather iconic setting along the waterfront, between the Brooklyn and Manhattan bridges. Dark wood dominates the light-filled interior, amid metal accents and walls that sprout greenery to soften the room. The food may have a farm-to-table focus, but a contemporary tilt is clear in everything that emerges from Atrium's bustling open kitchen. Elegant ""baby greens"" arrive as enticingly charred root vegetables over peppery arugula coulis; whereas crisply seared red snapper served over wild rice with dashi-simmered baby turnips, meaty mushrooms, and finished with a rich fumet makes the chef's (Laurent Kalkotour) French heritage abundantly clear. The chocolate-dipped crème fraîche and quark cheesecake is deservedly popular.",11201,40.703716,-73.99059,62.0,0,0,0,1,0,0,0,0,0,0,0,1,0,0,0,0,0,0
Tong Sam Gyup Goo Yi, Korean,"Murray Hill is no stranger to Korean food, but this prized, pig-loving barbecue destination is always packed. Inside, the bright room's décor forgoes all frills to focus on regional specialties. Smiling servers are earnest and hospitable. Begin with the usual but very exquisite banchan like pickled turnips, fermented bean paste soup, and specially aged house kimchi-funky, garlicky, and a total pleasure. Bowls of glassy naengmyun noodles dancing in a chilled broth with kimchi are just as popular. Yet what makes this place unique is that barbecue grill on each table, used for sizzling slices of flavorful duck with miso, garlic cloves, and bean sprouts; spicy, tender bits of octopus; and sweet, fatty pork with soy sauce, red chili paste, and scallions.",11358,40.762066,-73.803024,37.0,0,1,0,0,0,0,0,0,0,0,0,0,0,0,0,0,0,0
Toro, Spanish,"Trendy location? Check. Sleek, warehouse-sized space? Check. Floor-to-ceiling windows filled with romantic sunsets? Check. In brief, Toro is a head-turner graced with intent service and extraordinary food. Begin with inventive (and strong) crowd-pleasing sips at the impressive bar before settling in to a comfy communal table.The music gets louder at sundown, but find yourself fixated on such deeply flavorful pinchos as sardina y mantequilla de cabra (crusty bread spread with goat butter and preserved sardines) or aged duck ham kissed with olive oil, lemon zest, and sweet, delicious fat. Links of smoky, tender chorizo set over chickpea stew is a comforting creation, while inky-dark sepia risotto en su tinta made with orzo is rich, buttery, and perfect.",10011,40.74313,-74.007675,37.0,0,0,0,0,0,0,0,0,0,0,0,0,0,0,0,0,0,0
Narcissa, Contemporary,"André Balaz's Standard East Village hotel is where you will find one of downtown's snazziest dining rooms. Richly stained wood furnishings in contrasting hues pair beautifully with tanned leather banquettes, sienna table linens, and perfectly calibrated lighting. The overall effect is warmer than a Malibu sunset. Chef John Fraser (of Dovetail) has assembled a formidable team to realize his vision of polished farm-to-table dining, starring seasonal produce from the Hudson Valley. Beets take a turn in the rotisserie oven and arrive for your pleasure as a warm salad with hearty bulgur, pickled cucumber, and a pool of horseradish cream. Poussin is roasted whole and set atop steel cut oats slicked with jus, spicy sausage, and oven-wilted radicchio.",10003,40.72806,-73.9909,37.0,0,0,0,0,0,0,1,0,0,0,0,0,0,0,0,0,0,0
All'onda, Italian,"All'onda cuts a dramatic impression from the outset, especially come nightfall, when its narrow, all-glass façade lights up like a dream. Inside, you'll find a décor swept in whitewashed brick, rich walnut paneling, honeycomb tiles and lovely, whimsical flower arrangements. Also the co-founder of Uma Temakeria, Chef Chris Jaeckle pulls influence from all sorts of lands far and near, surprising customers with every new visit.Dinner might kick off with creamy hamachi crudo, sporting curls of crispy carrot and a fresh kick of peperoncino oil; and then move on to a nest of al dente bucatini twirled with uni, spicy breadcrumbs, and tarragon. Curly ramen-yes ramen-bobbing in parmesan broth with a soft egg, pork belly, and Brussels sprouts is a welcome surprise.",10003,40.73483,-73.99314,62.0,0,0,0,0,0,0,0,0,0,0,0,0,0,0,0,0,0,0
I Sodi, Italian,"Manhattan has classic Italian and new Italian, but not many thoughtful Italian restaurants. Tuscan native Rita Sodi is out to change that with this trattoria. She consciously selected every aspect of the design, from the heavy linen napkins to the thick, striated glass windows that hide the modern space from the marauding groups of young people on Bleecker. Inside this oasis, Negronis prep palates for al dente rigatoni and hearty, meat-focused dishes like the coniglio in porchetta. This exceptional rabbit preparation combines bacon-wrapped loin with a sweet wine- rosemary- and garlic-sauce. The herbal quality of such savoriness brings out the almost austere nature of the lean rabbit, showing how truly intuitive and innovative Italian cooking can be.",10014,40.733334,-74.00503,37.0,0,0,0,0,0,0,0,0,0,0,0,0,0,0,0,0,0,0
Piora, Contemporary,"The West Village's impossibly quaint charm gets even more charming with an elegant dinner for two at beautiful Piora. The setting is polished, upscale and cozy, with a marble bar up front teeming with well-heeled beauties sipping cocktails; and a sleek white dining room in the back, featuring a stunning wall of glass overlooking a lush urban garden. It's a soothing experience from the start, a chance to sit back and sink into a perfectly prepared drink (don't miss the creative libations) and let the hustle of the city slough off as you consider the neighborhood's manicured charms. The polished staff together with elegantly prepared and very contemporary cuisine-carefully presented and borrowing from the many influences of Piora's Korean-born owner and Italian-American chef-only seal the deal. Take the perfectly al dente rigatoni, plated with savory crumbles of ground lamb-and-pork sausage and laced with dollops of bright green nettle pesto, jalapeño slivers, and shaved pecorino; or a beautifully prepared Four Story Hill Farm poularde, rendered to juicy, crispy perfection, and garnished with tawny sweet potato, pickled mustard seeds, tender Brussels sprouts, and foie gras foam.",10014,40.730625,-74.00669,62.0,1,0,0,0,0,0,0,0,0,0,0,0,0,0,0,0,0,0
Sushi Nakazawa, Japanese,"This is a typical NY destination, right down to the tough reservation. The calm setting contrasts the buzz surrounding Chef Daisuke Nakazawa. That hype means the place operates at its own pace; and your meal depends on where you sit-the counter offers fresh, meticulously prepared sushi and engaging chefs, while the dining room is steerage with apathetic servers doling out mediocre pieces of sushi all at once. But, this kitchen is stocked with the best of America's waters. Uni from Maine is beautifully prepared and notable thanks to hay-smoked bonito. Then, expect a live scallop, pearly and sweet, with just a hint of yuzu pepper paste. And, that Florida tiger prawn could not be more fresh or enjoyable as it is knifed and shelled. For dessert, the lychee sorbet is ace.",10014,40.731716,-74.00451,112.5,0,0,0,0,0,0,0,0,0,0,0,0,0,0,0,0,0,0
Barawine, Contemporary,"Amid the leafy, brownstone-lined Mount Morris Park Historic District, Barawine is an inviting dining room overseen by Fabrice Warin (formerly the sommelier at Orsay). This eye-catching space emanates a warm glow, enticing Lenox Avenue passersby to step in for a drink, snack, and much more. The bar area's communal table is a convivial perch, in addition to the quieter seating in back. Throughout, whitewashed walls attractively double as wine storage. The crowd-pleasing menu defies classification but offers something for everyone. Expect to enjoy béchamel-enriched macaroni and cheese with diced ham and melted Gruyère; chicken breast with ratatouille and feta; as well as vegan options such as quinoa and grilled tofu salad, and dairy-free chocolate mousse.",10027,40.804707,-73.94764,37.0,0,0,0,0,0,0,0,0,0,0,0,0,0,0,0,0,0,0
The Cecil, International,"As evidenced by this buzzing hot spot, Harlem continues to prove it's a destination-worthy enclave for serious eats. Neon signage out front marks The Cecil's entrance and the lounge's provocative artwork gets things off to a sexy start once diners step inside. Dinner here is a trip around the globe, guided by a menu that spotlights Africa, Asia, South America, and the US South. Skillet-fried salmon, dusted with cornmeal for a satisfying crunch, comes plated atop spicy kimchi-inspired slaw; and the feijoada is a stoneware pot full of black beans, braised oxtail, and merguez garnished with slivered collard greens and orange segments. Even the wine list has a passport, with an impressive selection from black producers under the heading African Diaspora.",10026,40.80472,-73.95268,37.0,0,0,0,0,0,0,0,0,0,0,0,0,0,0,0,0,0,0
Juni, Contemporary,"Australian exports don't just include beef and precious metals-these days its chefs also seem highly prized by various countries around the world. Being largely unhindered by an allegiance to a particular culinary tradition seemingly allows them to freely embrace innovation and creativity, and they all arrive with a healthy international outlook. Cairns-born Shaun Hergatt's cooking is certainly original. Whether you're having the squab with salsify or the ""rabbit and the carrot,"" you'll know you're in the hands of a kitchen with a mastery of modern cooking techniques. His dishes are all artfully presented creations and the combinations of superlative ingredients and well-defined flavors display far greater depth than the somewhat terse three-word menu descriptions would suggest. The dining room, within the Hotel Chandler, is a touch anodyne and tables are ridiculously far apart, but the atmosphere remains far from solemn thanks, in no small part, to the personality and genuine care shown by the well-informed and helpful service team.",10016,40.746197,-73.98527,112.5,1,0,0,0,0,0,0,0,0,1,0,0,1,0,0,0,0,1
Clement, Contemporary,"This particularly elegant bar and dining room is one of the lucky few to call the Peninsula New York home. Created by design firm Yabu Pushelberg, the posh setting includes a series of rooms, each with their own striking touches that sprawl from a thickly carpeted staircase off the lobby. Worth a mention is the book room, with its stacks of bound-linen rag paper, mauve fabrics, and fresh flowers in mercury glasses. So too is the kitchen, whose talented team sends out ambitious preparations like the locally sourced scallop composition pairing carpaccio zested by pink grapefruit and yuzu with seared specimens swiped by sunchoke foam. Another winner is crisp-skinned black bass set beside maitake mushrooms and gussied up tableside with roasted duck broth.",10035,40.76156,-73.97513,62.0,0,0,0,0,0,0,0,0,0,0,0,0,0,0,0,0,0,0
Larb Ubol, Thai,"Chef Ratchanee Sumpatboon is cooking up her own delicious Isaan-Thai storm in Hell's Kitchen. Inconspicuously lodged between Penn Station and Port Authority, Larb Ubol is tidy, cheerful, and dressed with colorful fabrics. The som tom kort muar is cool and limey yet very spicy with green and red chilies dotting the crunchy mound of lettuce, green papaya, rice noodles, and fried pork rind. Savory and satisfying pla dook larb, a spicy ground catfish salad, combines wild ginger, fresh mint, and lime. The deep-fried pork belly, pad ped moo krob, is rendered crisp yet wonderfully chewy, then stir-fried with chopped eggplant, sweet red pepper, and red curry paste. Cool off with a scoop of coconut ice cream garnished with preserved palm seeds.",10018,40.75509,-73.99494,18.5,0,1,0,0,0,0,0,0,0,0,0,0,0,0,0,0,0,0
East Pole, Contemporary,"Just off Park Avenue's pre-war grandeur is this hip addition to the neighborhood, courtesy of the Fat Radish team. The cozy space is on the ground floor of a brownstone, so the setting is understandably narrow. East Pole's front bar is hopping, while black leather booths in the back allow parties to sit and enjoy an eclectic menu in relative peace. The stimulating cooking here begins with a salad of roasted heirloom carrots with hijiki, diced avocado, and an Asian-inspired soy-and-sesame oil vinaigrette. Then move on to explore Kiev-style chicken, stuffed with garlic butter-enriched broccoli purée, or creamy fish pie stocked with cod, lobster, and fennel. The adult ice cream sundae is a boozy combo of Scotch-chocolate ice cream and Pimm's-soaked cherries.",10065,40.766167,-73.96579,62.0,0,0,0,0,0,0,0,0,0,0,0,0,0,0,0,0,0,0
Gastronomia Culinaria, Italian,"From his experience in world-celebrated kitchens, Chef/owner Vincenzo Pezzilli has created this darling Italian restaurant that far exceeds the Big Apple's expectations. A native of Rome, he presides over his talented kitchen nightly, carefully watching over each sous as they transport authentic flavors to a dining room of locals and Ivy League professors. Paintings decorate exposed brick walls, and the soft lighting creates just the scene for satisfying dishes and Italian wines. Pastas induce swoons, especially the enticingly chewy strascinati alla norcina with garlicky pork and porcini bathed in a delectable vegetable ragù. To close, the tortino ai due cioccolati (dark chocolate cake filled with white chocolate) is absolutely worth the 20-minute wait.",10025,40.798923,-73.96181,37.0,0,0,0,0,0,0,0,0,0,0,0,0,0,0,0,0,0,0
Aita, Italian,"Tucked into a cozy corner, this quintessential trattoria echoes the beauty and charm of Clinton Hill. Amid a robust culinary scene, Aita finds a niche with its warm (never effusive) service and equally comforting décor of antique mirrors, wood paneling, and lacy curtains. Chef/co-owner Roberto Aita certainly has a way with pasta, crafting thick, homemade noodles twirled with flavorful sauces, such as the taglierini with buttery clam broth that is slightly sweet with melted leeks and strewn with irresistibly briny littlenecks. Italian tradition echoes through beguilingly simple desserts, like a bowl of plump fresh berries with nothing more than a dollop of cream and end-of-meal biscotti. The wines are as deliciously approachable as the cooking itself.",11238,40.686527,-73.96664,37.0,0,0,0,0,0,0,0,0,0,0,0,1,0,0,0,0,0,0
Dover, Contemporary,"Creative global accents are the guiding force behind the enticing lineup of plates at this tastefully spare candlelit bistro. Chefs Walker Stern and Joe Ogrodnek (the duo behind Battersby) prove the world is their oyster-raw or broiled and seasonally embellished to kick things off-so settle in and expect to be impressed. Sweet watermelon aguachile is boldly dressed with fresh lime juice, spicy green chiles, blistered shisito peppers and hit of feta; while house-made links of merguez are nestled in a thick and creamy chickpea purée dotted with plumped golden raisins and accompanied by perfectly puffy wedges of hot pita. Dessert is delicious and seasonal: picture a summery olive oil cake plated with white peach semifreddo and verjus gelée.",11231,40.680145,-73.997086,62.0,0,0,0,0,0,0,1,0,0,0,0,0,0,0,0,0,0,0
Take Root, Contemporary,"If you're lucky enough to score one of the precious few seats here, make it your mission to arrive on time. The tasting menu's procession begins promptly, so stragglers run the risk of missing out on its first luscious bites-and to deprive yourself of a crunchy fennel pollen-dusted potato croquette would be nothing short of a culinary crime. Since this is strictly a two-woman operation, the military-like precision is easily forgiven. Chef Elise Kornack single-handedly runs the immaculate kitchen while her wife, Anna Hieronimus, congenially attends to the tranquil, intimate dining room. But, the team works in tandem when it comes to presenting the uniquely composed plates. Substitutes are not offered, but there's little chance you won't be happy with what's to come. Black garlic-glazed lamb's tongue anticucho is a stimulating opening act for a refreshing summertime composition of slivered snap peas, intensely flavorful tomato pulp, wild ginger, and a creamy drizzle of chocolate mint purée. The chef's style is a fresh and light approach to quality product as seen in asparagus dressed with oysters whipped into a froth or roasted local pork plated with diced celtuce and wild strawberries.",11231,40.68445,-74.00025,112.5,1,0,0,0,0,0,0,0,0,0,0,0,0,0,0,0,0,0
Crazy Crab 888, Burmese,"You may second-guess your arrival to Crazy Crab 888 when you see the tarred-over landscape and auto body shops, but one step inside this downright delicious gem dispels any and all reservations. A sort of Burmese-Chinese seafood shack with influences from India and Thailand, the food offers recognizable ingredients in creative combos worthy of its wacky title-in Chinese culture, the number 8 is known to bring much good luck. The pickled ginger salad packs a punch-crunch of fried garlic with cilantro, and makes for a cooling lead into the seafood 888 platter of Dungeness crab and crawfish-complete with a bib! For more spice, Yunnan sliced pork, straight from the face of a pig, combines fleshy meat with peanuts and chilies for a funky, must-try delight.",11354,40.756847,-73.83401,37.0,0,0,0,0,0,0,0,0,0,0,0,0,0,0,0,0,0,0
M. Wells Steakhouse, Gastropub,"At this ultra-hip gastropub in Long Island City, first impressions can be wildly deceiving. At first, you'll wonder if you got the right address: from the outside, M. Wells Steakhouse looks like the old auto body garage it's housed in, but step inside and wow-the interior is all gloss and swagger, from its gold-and-black wallpapered ceiling and dripping crystal chandeliers, to its sexy red walls, stunning bar area, and open, wood-burning kitchen. Service is friendly and just as polished and charming as the design; though mercifully more earnest than hip. They seem refreshingly invested in your experience, dropping dishes with explanations; checking in regularly; and genuinely thanking you for your patronage. Don't miss the opportunity to drill them on wine pairing ideas. Their answers are thoughtful and spot-on. M. Wells may bill itself as a steakhouse, but the excellent raw bar, fresh fish entrées, and unique appetizers are up for some serious best supporting nods. Don't miss the bone marrow onion soup, a rich, delicious take on the French classic; rabbit terrine studded with candied fruit, truffle, and served en croute; and decadent Paris-Brest, a crispy pastry piped with hazelnut cream.",11101,40.748543,-73.94241,112.5,1,0,0,0,0,0,1,0,0,0,0,1,0,0,0,0,0,0
Venturo Osteria & Wine Bar, Italian,"From the moment it opened its doors, this delicious osteria has amassed a loyal following of Italian food fiends in Queens. Original canvas paintings dress the Aegean-blue walls and distressed wood accents reinforce the calm Mediterranean vibe-even at peak times. Chef Michelle Vido helms a dedicated kitchen that surprises with excellence and generosity. House-made defines every dish, from freshly baked focaccia to the honey yogurt drizzled upon a lemon tart. Plump P.E.I. mussels in a fiery, serrano-tomato broth make for a great snack. But, for a fuller meal, try chewy ribbons of whole-wheat fettuccine tossed with hedgehog mushrooms, leeks, and pancetta; or a roasted leg of lamb stuffed with garlicky herbs over braised chickpeas and escarole.",11104,40.743595,-73.920135,37.0,0,1,0,0,0,0,0,0,0,0,0,0,0,0,0,0,0,0
Cafe Katja, Austrian,"Beer mugs are clinking and schnapps is flowing at the rustic Cafe Katja. After slowly expanding to neighboring storefronts over the past few years, the owners have now realized its much-deserved grandeur without losing its charm. Expats plus locals are de rigueur here, and routinely stop in for incredibly delicious and unbelievably hearty eats. Co-chef and owner Erwin Schrottner (who hails from outside Graz) keeps everything authentic, from house-made bratwurst platters to the mustard sour cream. The pretzels arrive straight from Europe as divine carbo-bombs served with liptauer cheese and butter. The idea of warm chocolate cake may seem passé, but this rendition with terrifically bittersweet orange marmalade is a treat for all the senses.",10002,40.717693,-73.990524,37.0,0,0,0,0,0,0,0,0,0,0,0,0,0,0,0,0,0,0
