name,cuisine,blurb,ZIP,latitude,longitude,avg_USD,stars,bib,assiette,wine,view,garden,outside_dining,air_conditioning,no_dogs,parking,dinner_only,wheelchair,private_dining,with_rooms,booking,lunch_only,dinner_tasting,valet
Bar Masa, Japanese,"Make no mistake: Masa's adjacent lounge is by no means a bargain substitute for the stunner next door. Bar Masa remains as hopping as when it first opened, and on any given night every tightly packed seat is perpetually filled-thanks in part to a no-reservations policy. Despite the crowds, softly lit Japanese limestone walls give the room an air of serenity. The long list of creative sips are excellent, so lay your lips on a cucumber mint gimlet while eagerly awaiting selections off the extensive menu. Serious effort is blatantly apparent: raw petals of sakura trout are tantalizingly dressed; pudding-soft tofu and perfectly ripe avocado are a heavenly pairing for an uramaki; and fluffy wild mushroom fried rice is sprinkled with wasabi salt.",10023,40.76865,-73.98305,62.0,0,0,0,0,0,0,0,0,0,0,0,1,0,0,0,0,0,0
Del Frisco's, Steakhouse,"Prime, aged, corn-fed beef is the main attraction at this sprawling, outrageously successful outpost of the Dallas-based steakhouse chain. Portions range from the petite filet to a 24-ounce Porterhouse that will make any Texan proud. The menu begins with a suitably rich feast of cheesesteak egg rolls or white clam flatbread; but then does an about face with a knife-and-fork Caesar salad. Lunch is an affordable way to sample their classics. Complementing its McGraw-Hill Building home, Del Frisco's flaunts a masculine look with a large L-shaped bar, dramatic wrought-iron balcony, wood accents, and towering windows. The mezzanine dining area, accessible by a sweeping staircase, enjoys a quieter ambience. Del Frisco's Grille in Rockefeller Plaza is another option.",10019,40.75918,-73.98155,62.0,0,0,0,0,0,0,0,0,0,0,0,1,1,0,0,0,0,0
Golden Unicorn, Chinese,"This age-old dim sum parlor, spread over many floors in an office building, is one of the few Cantonese spots that actually has the space and volume to necessitate its parade of steaming carts brimming with treats. While Golden Unicorn's system is very efficient and part of the spectacle, arrive early to nab a seat by the kitchen for better variety and hotter items.A helpful brigade of suited men and women roam the space to offer the likes of exquisitely soft roast pork buns, or congee with preserved egg and shredded pork. Buzzing with locals and visitors, it is also a favorite among families who appreciate the kid-friendly scene as much as the delectable, steamed pea shoot and shrimp dumplings, pork siu mai, and rice rolls stuffed with shrimp.",10002,40.71368,-73.99714,37.0,0,0,0,0,0,0,0,0,0,0,0,0,1,0,0,0,0,0
Smith & Wollensky, Steakhouse,"Sitting proudly on the corner of Third Avenue for nearly 40 years, Smith & Wollensky is a veritable New York institution. This is the kind of clubby steakhouse where stellar martinis are still poured tableside and the regulars get their names engraved on a plaque. It's where business deals go down and old-time Manhattanites live it up. Begin with beloved classics, including a beefsteak tomato-and-onion salad finished with house dressing and crumbled blue cheese; or spoon-licking sides like creamed spinach, crispy hash browns, and crunchy onion rings. Then, allow the adept servers to steer you towards the in-house favorite-namely, a beautifully marbled, deliciously fatty, and perfectly tender Colorado rib steak, bone-on and big enough for three.",10035,40.7553,-73.97087,112.5,0,0,0,1,0,0,1,0,0,0,0,0,1,0,0,0,0,0
Kurumazushi, Japanese,"Mimicking Tokyo's tucked-away restaurant style, this sushi destination is located up a dark staircase in a midtown building and through a sliding door. The focal point of the room is the sushi bar, where Chef/owner Toshihiro Uezu meticulously prepares each morsel in a minimal space. For the full theatrical experience, brace your wallet and settle into the omakase. The undeniable quality of each ingredient is center stage, displayed simply on stone glazed pottery. Take a cue from the Japanese and limit conversation: the succession of sashimi and sushi is quick, and all senses should work together without distraction to savor the smooth, buttery fatty tuna, Spanish mackerel (with its lightly blistered skin), pearly white sea bream, and rich unagi.",10017,40.75651,-73.97766,112.5,0,0,0,0,0,0,0,0,0,0,0,0,0,0,0,0,0,0
Prune, American,"Chef Gabrielle Hamilton's sterling little bistro has long bewitched the city's foodies who cram its bar and row of tables. Unpretentious cooking in a room branded by pops of purple is Prune's hallmark, and a completely revised menu shines with newfound inspiration. ""Straw and hay"" pasta-fresh strands of egg and herbed linguine-is sauced with chicken livers and diced green tomatoes, while deep-fried rabbit is seasoned with romesco salt, and sided with buttermilk dressing. For the most simple yet epic finale ever, the season's best peaches are lightly sugared and laid over warm buttered toast. Prune's daiquiri (a zesty combination of three rums garnished with a vanilla bean swizzle stick that perfumes each sip) is proof of serious cocktail creativity.",10003,40.72381,-73.98921,37.0,0,1,0,0,0,0,0,0,0,0,0,0,0,0,0,0,0,0
Mezzaluna, Italian,"Time and time again, this Italian idol hits the spot. Just take a look at the jubilant crowd huddled together at pink granite tables throughout the Euro-chic yet cozy room. One wall is yellow while another is completely lined with 77 depictions of the restaurant's name, beneath a sky-blue ceiling painted with clouds. Neighborhood residents and savvy tourists know Mezzaluna's unfussy Italian cooking is guaranteed to be delizioso. Take for example the veal Milanese-pounded thin and delicately crunchy, simply topped with peppery wild arugula and sliced cherry tomatoes. Other hits include pizzas that emerge from a wood-burning oven unceremoniously stationed in a corner, or beef carpaccio with a choice of toppings like artichokes and Parmigiano Reggiano.",10021,40.77122,-73.95919,37.0,0,0,0,0,0,0,1,0,0,0,0,0,0,0,0,0,0,0
Beyoglu, Turkish,"Upper East Siders can't get enough of the meze at cheerful Beyoglu and its enticing Turkish, Greek, and Lebanese cooking. Vibrant flavors enhanced by garlic and herbs start with chilled platters loaded with hummus, mashed eggplant spread (patlican salatasi), and salads like kisir, tabbouleh made with cracked wheat. The only other thing you'll need to fully enjoy the Beyoglu experience is a bowl of strained, house-made yogurt. That flatbread is pulled straight from the hot oven only to arrive on your table seconds later, gratis and absolutely gratifying. Tile-topped tables and pistachio-green walls displaying painted flowers accent the interior. French doors separate the dining room from the sidewalk, but during warm weather both areas fill quickly.",10028,40.77534,-73.95624,37.0,0,1,0,0,0,0,1,0,0,0,0,1,0,0,0,0,0,0
Peasant, Italian,"Year after year, Peasant hits it out of the park-from the mouthwatering Italian food to the spot-on service to the utterly charming osteria spirit, Frank DeCarlo's ode to the Italian gathering spot is the essence of easy excellence. The décor is charmingly rustic-picture whitewashed walls, bare wood tables, and a bustling downstairs wine bar. Kick things off with ricotta and otherworldly bread, fresh from the visible centerpiece hearth-which is the main method of cooking and sets this spot apart. But save room for house-made lasagna with braised rabbit ragù, creamy béchamel, and sweet root vegetables; tender razor clams in a fragrant white wine broth; succulent porchetta studded with garlic and rosemary; or stewed and perfectly chewy trippa alla Romana.",10012,40.72176,-73.99422,37.0,0,0,0,0,0,0,0,0,0,0,0,1,0,0,0,0,0,0
Café Mogador, Moroccan,"The key to this beloved café's long-term success is its popular array of tasty, crowd-pleasing Moroccan favorites. A veritable landmark in the East Village, the decades-old hangout is as inviting as ever-and despite the constant crush of its brainy-hip set, it remains inexplicably fresh-faced. Open from morning to night, breakfast offers the likes of eggs any style sided by hummus and tabouli, whereas afternoon fare may include tasty specials like bastilla or harira-the hearty and fragrant soup. Chicken tagine is excellent: try it with fluffy couscous and charmoula, a spicy green herb sauce, or order it Casablanca-style with chickpeas, raisins, and onions. For a taste of Morocco across the East River, visit Mogador's flourishing Williamsburg outpost.",10009,40.72739,-73.9844,18.5,0,0,0,0,0,0,1,0,0,0,0,0,0,0,0,0,0,0
Roberto's, Italian,"You can't miss Roberto's, whose distinctive design falls somewhere between a cozy, welcoming farmhouse and a Mediterranean villa complete with a coral-hued façade and wrought-iron balcony. One of the most highly regarded restaurants in the borough, this storied Italian-American is the kind of charmer that makes groups feel right at home. It's also the kind of place that piles on the pasta and takes espresso seriously, whether it's the fettuccine special that features fresh shaved truffle, the soft-shell crabs finished in a butter-white wine sauce, or the ricotta cream that fills an insanely good cannoli. For a real taste of what makes Roberto's shine, let the hearty tubettini con polipo e fave, folded with grilled octopus, fava beans, and baby clams speak for itself.",10458,40.85382,-73.8884,37.0,0,0,0,0,0,0,0,0,0,0,0,1,1,0,0,0,0,0
BLT Prime, Steakhouse,"Prime Angus beef broiled at 1700 degrees fahrenheit, dabbed with herb butter, and presented on sizzling hot cast iron is the reason this Gramercy steakhouse continues to bask in unbridled success. Power brokers are found unwinding at the bar and downing classic cocktails before settling into taupe banquettes trimmed with gleaming zebrawood tables. The menu is printed on brown craft paper, but is also grandly displayed on a huge wall-mounted board. Steak may be the most popular option, but this kitchen's talent runs deep. Sautéed Dover sole with soy-caper brown butter is a favorite among seafood fans. The nightly prix-fixe has included beautifully done wild Scottish partridge, wrapped in pancetta and plated with melted Savoy cabbage and apple cider jus.",10010,40.7395,-73.98618,62.0,0,0,0,0,0,0,1,0,0,0,0,1,1,0,0,0,0,0
New Leaf Café, American,"Located in a 1930s mansion designed by the Olmstead brothers, New Leaf Café was opened as part of the New York Restoration Project. The inside feels like a large cottage with stone walls and arched windows. Alfresco lunch on the flagstone terrace showcases this high, hilly setting with unparalleled views of the Palisades (squint to find the George Washington Bridge). The American menu features a fried risotto cake with gooey mozzarella over Tokyo turnips and sweet pea coulis; or a hunk of seared tuna with tiny mushroom-filled ravioli. Profiteroles are a particular treat, filled with vanilla ice cream and drizzled with luscious chocolate sauce. The gorgeous surrounds and jazz concerts make this a sought-after spot for private events after sun down.",10040,40.86105,-73.93278,37.0,0,0,0,0,0,0,1,0,0,0,0,1,0,0,0,0,0,0
Eliá, Greek,"This sliver of Mykonos in Bay Ridge evokes the Greek island spirit with its white walls, baby-blue accents, and rustic wood-beamed ceilings. Choose between the charming backyard patio, the small bar, or a table surrounded by woven chairs. Then, tuck into a menu of Greek classics, beginning with the deliciously familiar flavors of spanakopita, elegantly presented as small triangles of buttery filo filled with earthy spinach, tender leeks, and a whisper of salty feta. Slightly charred and nicely crunchy grilled shrimp arrive on a bed of plump Israeli couscous tinted pink with pomegranate syrup. Crowd-pleasing options include house-made ravioli filled with shredded braised lamb. Rizogalo (rice pudding) is topped with preserved cherries and crunchy granola.",11209,40.62307,-74.03094,37.0,0,0,0,0,0,0,1,0,0,0,0,1,0,0,0,0,0,0
Applewood, American,"A rustic counterpoint to the common hip Brooklyn restaurant, find Applewood in a quaint corner townhouse with wrought-iron fencing, box planters, and wooden park benches out front. The inside may appear cramped at first, but perception shifts once seated as the fireplace, exposed brick walls, pressed-tin ceiling, and shelves lined with books work their cozy magic. Dishes are layered with flavor, including chewy herb spaetzle and wilted greens topped with grilled lamb sausage and mustard seeds. Pickled red cabbage tops a pork chop sliced off the bone, with a light yet delish potato gratin on the side. High-minded desserts may include a warm carrot cake with fragrant cardamom syrup. A reasonably priced three-course prix-fixe turns locals into regulars.",11215,40.66571,-73.98214,37.0,0,0,0,0,0,0,0,0,0,0,0,0,0,0,0,0,0,0
Bottega del Vino, Italian,"For true Northern Italian elegance, Bottega del Vino is divine, no matter the time of day. In front, casual Bar Quadronno caters to local business people looking to meet for a European-style breakfast, light lunch, or unbeatable cappuccino. Head to the more formal, rear dining room with tables dressed in white to savor a very authentic Italian meal. Veronese influence is clear from the start, with dishes like whole grilled calamari served simply over a bed of arugula drizzled in excellent olive oil with a splash of lemon. The pillowy spinach and potato gnocchi swimming in a creamy sauce with crisp prosciutto and pecorino outdoes most other plates like it in the city. Finish with warm Nutella-filled crêpes served with vanilla ice cream.",10022,40.76417,-73.9722,112.5,0,0,0,1,0,0,0,0,0,0,0,0,1,0,0,0,0,0
Aroma Kitchen & Wine Bar, Italian,"When dolled-up crowds pack this cobblestoned street, the staff rises to the occasion with true Italian hospitality. Despite the trendy surrounds, authenticity is paramount as orange-framed doors are flung open to reveal lovely rustic rooms and a quiet, contemporary aura. The front area presents mirrors, a wood bar, and hefty shelves of interesting wines. Beyond brick archways, a communal table in the dining room is ideal for savoring summer's bounty beautifully showcased in scafata di verdure, a zuppa bobbing with quadrettini dressed in a bright vegetable ragù. Flavorful bites of strascinati are tossed with sublime Moliterno cheese, lamb sausage, and smoky red peppers. A scoop of stracciatella gelato or the daily sorbetto ensures an exalted finish.",10003,40.7271,-73.99209,37.0,0,1,0,1,0,0,0,0,0,0,0,0,1,0,0,0,0,0
The Stanton Social, Fusion,"This hugely favored haunt's low lighting, thumping beats, and beautiful crowd clearly say nightlife lounge, but its roster of pleasing creations establish the kitchen as an expert in flavors and textures. The multi-level room is sexy yet remains timeless despite its age. Those chic, dark leather banquettes provide plenty of space for large groups to kick back to whatever the DJ spins in the second-floor lounge. This isn't a place for conversation between friends, but rather a large group destination for delicious small plates like crisp red snapper tacos with creamy avocado and zesty mango salsa. Tasty Asian flavors combine seamlessly with chunks of skewered salmon cooked rare and coated in crunchy sriracha-infused peas over cold soba and earthy beets.",10002,40.7213,-73.98802,37.0,0,0,0,0,0,0,0,0,0,0,0,0,0,0,0,0,0,0
Cookshop, American,"Airy, sun-flooded, and in a location that still manages to seem brand-spanking new, Cookshop brings highbrow dining to western Chelsea. The plant-filled dining room is furnished with ethically sourced American oak tables and spotlights a wall of banquettes. The bar is perfect for solo dining.The kitchen drives this locavare philosophy with energy and skill. A cooling late-summer tomato soup is a smooth balance of sweet and tart flavors, enhanced with tangy lemon-basil and riesling. House-made lasagnette highlights the best of the season with high-minded Italian style, through tight, wavy ridges of pasta beautifully dressed in delicate pesto. Save room for sweet treats like a peanut butter Bavarian with Concord grape granite and milk ice cream.",10011,40.74557,-74.00539,37.0,0,0,0,0,0,0,0,0,0,0,0,0,0,0,0,0,0,0
Cacio e Pepe, Italian,"This charming Italian gioia has welcomed diners for more than a decade now. But in relaying its pleasures, one must begin with the eponymous house specialty. This fresh tonnarelli tossed with pasta water, olive oil, cracked black pepper, and a showering of pecorino is pure delight. Those willing to branch out will find other pasta dishes here as equally pleasing, like the maltagliati dressed with a savory monkfish ragù revved up with olives, capers, and an unexpected hit of ginger. Mussels in black pepper ""soup"" is a savory bowl of mollusks and broth with garlicky croutons for soaking up the enticingly salty liquid. Exposed brick and wood furnishings complement the zucca-orange walls lined with wine bottles offered on the all-Italian list.",10003,40.73059,-73.9858,37.0,0,0,0,0,0,0,1,0,0,0,0,0,0,0,0,0,0,0
Barbounia, Mediterranean,"Barbounia brings the pleasures of the Mediterranean to a primo locale. The welcome is warm, the ceilings are notably high, and the floor-to-ceiling bar is considerably stocked (note the wine list and its surprisingly large selection from Greece). The dining room is crowded with tables, so go for the cozy corner banquettes overlooking the action. The rustic, satiating fare is ideal for sharing. Thick pieces of octopus are grilled to a buttery softness and served over marinated chickpeas with olives, oregano, and a slick of labneh. In the shakshuka with merguez, a cast iron skillet arrives bursting with flavor and bubbling at the table with a piquant paprika-spiked tomato sauce topped with baked eggs and studded with roasted peppers and sausage.",10003,40.73833,-73.98809,37.0,0,0,0,0,0,0,0,0,0,0,0,1,0,0,0,0,0,0
Copper Chimney, Indian,"Copper Chimney is a pleasing and tasteful retreat from Curry Hill's sassier options. Polite service and a dining room of pale gray walls and buff-colored banquettes soothe the spirit. But, one peek at the expansive menu is sure to entice your palate. The regional offerings bring extensive choice, with myriad vegetarian and tandoori specialties. Mild but flavorful curries like dalchi machi feature salmon in a pale orange sauce that is thick as dal and seasoned with mustard seeds, curry leaves, and whole dried red chilies. Baingan bartha is a sumptuous blend of roasted and mashed eggplant cooked with onions, tomatoes, and spices. Breads served hot off the tawa are a must, like the aloo paratha which is pillowy soft and stuffed with spiced potatoes.",10016,40.7427,-73.98305,37.0,0,0,0,0,0,0,0,0,0,0,0,0,0,0,0,0,0,0
Barbuto, American,"When New Yorkers dream of living in the West Village, Barbuto has a place in that dream, too. Springtime lunches with garage doors open to the sidewalk, and a feast of refined, simple dishes have earned Jonathan Waxman a devoted following in a neighborhood already full of charming restaurants. Casually professional service and the dimly lit dining room's dose of California cool enhance the experience. Barbuto's roast chicken deserves its legendary status, but other dishes tempt too. A cavolo nero salad of thinly sliced black kale and crunchy breadcrumbs tossed in a creamy dressing of anchovies and pecorino puts the average kale salad to shame. Linguini is coated with black pepper, egg, pancetta, and cheese in one indelible plate of carbonara.",10014,40.73781,-74.00796,37.0,0,0,0,0,0,0,0,0,0,0,0,0,0,0,0,0,0,0
Bianca, Italian,"There's a reason diners from all over the city clamor to squeeze into Bianca's low-lit and lovely little dining room, despite its no reservations policy. This is home-style Italian fare with finesse-where the pasta is cooked by someone accomplished in the understanding of what Italian pasta is and is not. Bianca's intimate and sultry atmosphere makes it a great date night spot, with couples knocking elbows over dishes like the lasagnette di verdure, a delicate eggplant, zucchini and tomato tart of sorts. Others delight in the soft tagliolini ai frutti di mare, tossed with wildly fresh seafood and a long-simmered tomato sauce; or plump, fennel-studded Italian sausage (salsiccie e fagioli), paired with a hearty and savory cannellini bean stew.",10012,40.72551,-73.99253,37.0,0,1,0,0,0,0,0,0,0,0,0,0,0,0,0,0,0,0
Perry Street, Contemporary,"All New York gastronauts will be familiar with the Vongerichten name but it's actually Jean-Georges' son Cédric who heads up the kitchen here. The restaurant is on the first floor of the Richard Meier Towers and, if you stretch, you can just about see the Hudson outside. The room is bright, open, and contemporary although the anodyne muzak suggests a lack of faith in their customers' ability to create their own atmosphere or an acknowledgment of the room's lack of warmth. The influences on the food are largely French and American with the occasional Asian note. The combinations on the plate are nothing too challenging; dishes are colourful; and the flavors pronounced. The great value lunch menu should make it far busier during the day than it is.",10014,40.73447,-74.00974,37.0,0,0,0,0,0,0,0,0,0,0,0,1,0,0,0,0,0,0
Dinosaur Bar-B-Que, Barbecue,"Huge, loud, and perpetually packed, this way west Harlem barbecue hall draws crowds from near and far. The bar area is rollicking, and for that reason kept separate from the dining quarters. There, wood beams and slats, swirling ceiling fans, and oxblood leather booths fashion a comfortable-and quieter-setting. The scent of wood smoke wafting through the red brick structure (which coincidentally once served as a meatpacking warehouse) only heightens the diners' carnivorous cravings. Minimize decision-making and order the Extreme Sampler: a heaping feast of apple cider-brined smoked chicken, dry-rubbed slow-smoked pork ribs, and lean Creekstone Farms brisket. Add on a creative side or two-perhaps the barbecue fried rice studded with bits of pulled pork?",10027,40.81817,-73.96079,37.0,0,0,0,0,0,0,0,0,0,0,0,1,0,0,0,0,0,0
Katz's, Deli,"One of the last-standing, old-time Eastern European spots on the Lower East Side, Katz's is a true NY institution. It's crowded, crazy, and packed with a panoply of characters weirder than a jury duty pool. Tourists, hipsters, blue hairs, and everybody in between flock here, so come on off-hours. Because it's really that good. Walk inside, get a ticket, and don't lose it (those guys at the front aren't hosts-upset their system and you'll get a verbal beating). Then get your food at the counter and bring it to a first-come first-get table; or opt for a slightly less dizzying experience at a waitress-served table. Nothing's changed in the looks or taste. Matzo ball soup, pastrami sandwiches, potato latkes-everything is what you'd expect, only better.",10002,40.72235,-73.98743,18.5,0,1,0,0,0,0,0,0,0,0,0,0,0,0,0,0,0,0
Aburiya Kinnosuke, Japanese,"Call it a trip to Tokyo without the tariff. This dark, sophisticated Japanese izakaya is tucked down a side street in bustling midtown. Grab an intimate table for two or join the crowd at the open kitchen counter surrounding the smoky robata grill. The waiters talk up the omakase, but it's worth trusting your own instincts to guide you on a personalized tour through their authentic offerings. The sukiyaki is a must-try seasonal offering of tender marbled beef served in a hot pot bobbing with a beaten egg, tofu, vegetables, and noodles. Other favorites include smoky bamboo shoots fresh off the robata with shaved bonito; and their legendary tsukune, a tender ground chicken meatball brushed with teriyaki and dipped in raw egg.",10017,40.75265,-73.97232,62.0,0,0,0,0,0,0,0,0,0,0,0,0,0,0,0,0,0,0
Sakagura, Japanese,"Got sake on the brain? You'll need to book in advance, but tucked away in the basement of a midtown office building, Sakagura is an amazing little hideaway with a phenomenal sake list (including seasonal selections) and a smattering of delicious small plates for pairing. All this fabulousness may have gone to their head a bit as the service seems a bit lacking these days, but it's worth it for that flash of authentic Tokyo by way of midtown. A couple of gems off the massive menu include the uzaku, grilled eel with cucumbers and seaweed in vinaigrette; perfectly chewy soba noodles presented in a traditional basket with dipping sauce, scallion, and wasabi; and tender tori karaage, a delicious Japanese fried chicken marinated in sake, soy, and ginger.",10017,40.75137,-73.97317,62.0,0,0,0,0,0,0,0,0,0,0,0,0,0,0,0,0,0,0
Sip Sak, Turkish,"The celadon façade of this tiny Turkish treasure with its frosted glass awning and art nouveau look holds its own in mundane midtown. Walls lined with large mirrors and a shiny pressed-tin ceiling stand over an armada of cool white marble-topped tables and bentwood bistro chairs. The décor seems French, but the cuisine leads to the Eastern Mediterranean with a definite stop in Turkey. A central, fully stocked bar serves as the launching point for Chef Orhan Yegen, who can be seen (and heard) directing his staff as they entice diners with a meze of citrusy olives, delicious hummus, garlicky cacik, and creamy tarama. House specials like rustic braised lamb chunks set atop a smooth eggplant purée seem straightforward but are deeply comforting.",10022,40.75448,-73.96853,37.0,0,0,0,0,0,0,0,0,0,0,0,0,0,0,0,0,0,0
