name,cuisine,blurb,ZIP,latitude,longitude,avg_USD,stars,bib,assiette,wine,view,garden,outside_dining,air_conditioning,no_dogs,parking,dinner_only,wheelchair,private_dining,with_rooms,booking,lunch_only,dinner_tasting,valet
Jin Ramen, Japanese,"All you really need to know is that this is the hands-down best ramen above 59th Street. Sure, decorative elements are simple, and it hardly matters that this little gem is hidden behind the 125th Street station's brick escalator. What comes from the kitchen deserves kudos. The menu is concise, offering a few items such as house-made gyoza for starters. These pan-fried shrimp dumplings have a delicate, crisped wrapper and arrive with sesame-seed flecked dipping sauce. Shio, shoyu, and miso ramen are all delightful, but the tonkatsu ramen is a special treat. The piping hot, almost creamy, mouthcoating distillation of pork bones is deliciously rich and stocked with fragrant chasu, pickled bamboo shoots, slivered green onion, and a soft-boiled egg.",10027,40.81547,-73.95866,18.5,0,1,0,0,0,0,0,0,0,0,0,0,0,0,0,0,0,0
Café China, Chinese,"An inconspicuous façade lost in midtown masks this striking restaurant, decorated with seductive portraits of 1930s Shanghai starlets, bright red chairs, lush bamboo planters, and a dominating marble-and-dark wood bar.The kitchen continues to struggle with popularity, yet on each table find balanced and elegant expressions of Sichuan cuisine that can stand above most in the city-one that avoids the easy umami of monosodium glutamate and egg rolls for composed, elegant expressions of this region's dishes. The almost overwhelming menu features dozens of cold and hot appetizers, noodles, entrées, and desserts. From refreshing pieces of cold-poached chicken tossed with a generous mound of chili-oil and peanuts, to aromatic smoked tofu mingled with silky batons of celery stalk, flavors here often bring more complexity than straight heat and the presentations are more genteel than brute. But that's not to say the kitchen doesn't conduct a fiery arrangement-try crisp, meaty, and double cooked pork belly harmonized with hot Sichuan peppercorns, green bell peppers, leeks, and fermented black beans. It's a face-melting experience that is more New York authentic, but still, devilishly delicious.",10016,40.749973,-73.98228,37.0,1,0,0,0,0,0,0,0,0,0,0,1,0,0,0,0,0,0
Vitae, Contemporary,"Ordering an Old Fashioned at lunchtime is fraught with all sorts of social implications so praise be to restaurants like Vitae, which are grown up enough to ensure that no eyebrows are raised when someone decides they want lunch the old fashioned way. This is a sophisticated and elegant midtown restaurant with an appealing self-confidence. Even the soundtrack appears to have been chosen by someone who actually knows what good music sounds like. Service is snappy, assured, and well-organised. The menu is contemporary without being faddish. Flavor combinations, such as the sesame salmon with soy, are recognizable and complementary and dishes pass that most basic of tests: they are very easy to eat. And those cocktails are pretty good too.",10017,40.755806,-73.97848,62.0,0,0,0,0,0,0,0,0,0,0,0,1,0,0,0,0,0,0
Añejo, Mexican,"This tasty cocina set in Hell's Kitchen is unpretentious and intimate. The house is always full and crowds are convivial, especially while sipping one of Añejo's beloved cocktails. The namesake margarita is an upscale, top-shelf refresher made with fresh lime juice and agave nectar that pairs perfectly with just about anything from the kitchen. Ceviche, small plates, and tacos are all to be enjoyed with gusto. Start with the guacamole trio featuring traditional, pineapple-chipotle, and tomatillo-charred poblano variations. Then move on to a warm mushroom salad with wilted watercress, brown butter, and Berkshire pork chorizo. Pumpkin tamale is an outstanding deconstructed square of smashed kabocha squash, lamb barbacoa, and crema inside a banana leaf.",10036,40.762802,-73.99312,37.0,0,0,0,0,0,0,0,0,0,0,0,1,0,0,0,0,0,0
Benares, Indian,"Unassuming inside and out, Benares serves solid Northern Indian fare in a casual setting. The South Asian clientele is testament to its authenticity. The décor may seem a bit limited, but thoughtful touches include a colorful glass chandelier and a framed painting of women washing clothes along the Ganges (in the restaurant's namesake city). Fragrant spice mixtures abound as seen in succulent and crunchy shrimp marinated with ajwain, garlic, and ginger, then grilled in the tandoor. Curry offerings showcase boldly satisfying comfort food, such as bowls of fork-tender rezala, the goat served bone-in with fragrant saffron and creamy yogurt. Any meal here should be accompanied by pillow-soft naan, and thick cucumber raita dotted with a pungent masala.",10019,40.76581,-73.98279,37.0,0,0,0,0,0,0,0,0,0,0,0,0,0,0,0,0,0,0
Hakkasan, Chinese,"When you fancy eating somewhere sensual and sophisticated, then going to the Theater District is unlikely to be your first thought. At least this sleek, moodily-lit Chinese restaurant comes with an 80-foot corridor behind its front door, allowing you time to adjust from tourist town to sexy sanctum. Cobalt-blue glass, marble and mirrors help create a striking space that feels surprisingly intimate considering its size. Service may need the occasional prompt but the Cantonese food is good and the cocktails terrific. Standouts are stir-fried sugar pea shoots with crabmeat and scallops, and jasmine tea-smoked chicken. And if you're wondering how they charge what they do for sesame prawn toast, order it and you'll see (clue: it's the foie gras).",10036,40.758232,-73.99008,112.5,0,0,0,0,0,0,0,0,0,0,0,0,0,0,0,0,0,0
Kristalbelli, Korean,"Turning up the heat in the dreary Garment District, Kristalbelli is a sexy harbinger of this fast-changing neighborhood. Outside, a gray slate- and marble-façade plus an impressive wooden door imply opulence; inside, crystal barbecue grills set on grey marble framed by a jolly gold monk make table-top dining over-the-top. The fun and bling continues upstairs in the young, hip, and hopping lounge. Yet amid all this glitz and glam is a well-trained service team and very talented kitchen. Banchan opens with a superlative assortment that might include green chilies with fermented bean paste, marinated mushrooms, cold egg custard with scallions, and kimchi. A sparkling signature crystal bowl does not distract from the deeply flavored, almost buttery ribeye.",10018,40.75008,-73.984474,62.0,0,0,0,0,0,0,0,0,0,0,0,1,1,0,0,0,0,0
Lugo, Italian,"In a blah locale that's overshadowed by crowds spilling from Penn Station and Madison Square Garden, this café shines bright as a recommendation for Italian eats. A boisterous scene prevails, as the bar and dining room are overwhelmingly popular among business folk. Light streaming in from the floor-to-ceiling windows shows off a white-tiled bar area and black-and-white photography. A pastel-green Vespa adds an extra dose of charm. Tables receive a satisfying array of items like warm hand-pulled mozzarella, Neapolitan-style pizza, and zesty entrées like Mediterranean branzino with spicy puttanesca. Pasta is deftly prepared and certainly a worthy indulgence, especially the tiny ridged tubes of rigatoncini coated with slow-cooked, meaty Bolognese.",10001,40.75124,-73.99332,37.0,0,0,0,0,0,0,1,0,0,0,0,1,0,0,0,0,0,0
atera, Contemporary,"Well, hello there, Ronny Emborg-this visionary new culinary talent takes the reigns at Jodi Richard's sleek TriBeCa tasting menu restaurant, atera-and the results are nothing short of sublime. Guests access atera by an ultra-discreet entrance; from there, a polished and attentive staff member might offer you a complimentary drink before whisking you off to a lovely, U-shaped counter with supple leather seats positioned to watch the kitchen execute its magic. Sound like a beautiful dream? It is wonderfully real, and that's before they ply you with their excellent wine pairing, cocktails or tea tasting (yes, tea-trust us, you'll be talking about it for days). Chef Emborg's Danish-accented menu might begin with an exquisite chilled green tomato soup with juniper oil, before proceeding to a buttery waffle with savory mushroom cream and earthy black truffle. Then, tender snow crab in an ethereal tomato broth with rose hip cream; or sweet scallop with crisp green apple, dill fronds and horseradish ice may be tailed by springy sepia plated with tart currants and laced with a deadly delicious hazelnut fish cream. Plump razor clams in a miso-brown butter broth are topped with bitter greens and foam for added flavor.",10013,40.716797,-74.00565,112.5,2,0,0,1,0,0,0,0,0,0,0,0,0,0,0,0,0,0
Zutto, Asian,"Exposed filament bulbs and a red brick wall give this cozy Japanese pub an inviting, industrial feel. There is a communal wood table for groups, small sushi bar, and long wall of banquettes and tables topped with linen napkins cleverly folded, origami-style. Service is eager, efficient, and less concerned with the flow of a leisurely meal. Unlike many Japanese restaurants with one specialty, this izakaya's diverse menu includes bar snacks, sushi, steamed buns, and ramen. Tangy, spicy buffalo cauliflower is a playful take on wings, replacing chicken with bright orange chunks of deep-fried cauliflower tempered by cool, creamy ranch sauce. The Zutto fried rice is another ideal drinking accompaniment, peppered with kimchi and pastrami beneath a runny egg.",10013,40.718517,-74.00884,37.0,0,0,0,0,0,0,0,0,0,0,0,0,0,0,0,0,0,0
Yefsi, Greek,"Chef Christos Christou brings a wealth of experience to the kitchen of this Yorkville standout. Having manned the stoves at some of the city's Greek stalwarts, the Cyprus-native knows his way around his Aegean and Mediterranean coastal specialties. Begin with salads showcasing superb feta or explore the array of luscious meze including zucchini and eggplant chips with tzatziki, octopus braised in mavrodafni or wine-spiked tomato sauce, and grilled sausages over black-eyed peas. Entrées entice with freshness and flavor, such as the wow-inducing nightly special of grilled tiger shrimp. Served head-on and lobster-like in size and texture, they are accompanied by a mound of creamy spinach rice and squeeze of fresh lemon-the perfect embellishment.",10075,40.77091,-73.950775,37.0,0,0,0,0,0,0,0,0,0,0,0,0,0,0,0,0,0,0
Caffè Storico, Italian,"Gone are the days when museum food lacked character, and top Philadelphia restaurateur Stephen Starr's Caffè Storico proves it. Housed in the New York Historical Society, this marble-clad sparkler incorporates the collection into its design, with antique porcelain filling its sky-high shelves and views of the sculpture arcade. Starr certainly knows how to please a crowd with marvelous salads and Italian-inspired dishes alongside unique wines from some of the country's emerging regions. Though frittata del giorno pocked with red peppers, tomato, and mozzarella, as well as panzanella with creamy burrata are eye-poppingly good, save room for a berry crostata whose flaky crust is perfectly accompanied by a smidge of vanilla ice cream.",10023,40.779114,-73.97384,37.0,0,0,0,0,0,0,0,0,0,0,0,1,0,0,0,0,0,0
Allswell, Gastropub,"It's all good at this all-day Williamsburg tavern, where the vibe is welcoming and the setting is comfortable. Come as you are for friendly service amidst a patchwork of vintage wallpaper, then settle in to choose from the enjoyable selection listed on the wall-mounted blackboard. In keeping with the cozy atmosphere, brunch is served every day of the week. Offerings include eye-opening chorizo and beans with poached eggs; and smoked whitefish toast-house-baked brioche topped with fresh ricotta and large chunks of infused fish, sided by a perfect boiled egg and parsley salad. Dinner brings yet more comfort fare like orecchiette with lamb ragù and fava beans; grilled chicken with lentils; or divine sweets like a tall wedge of seed-crusted cinnamon cake.",11249,40.71961,-73.95583,37.0,0,0,0,0,0,0,0,0,0,0,0,0,0,0,0,0,0,0
Blanca, Contemporary,"Tucked deep into the Roberta's compound-that den of restaurant cool that helped elevate seedy Bushwick into a legitimately haute food 'hood-lays this gleaming warehouse kitchen aimed at the serious eater. If you're lucky enough to snag a seat at Blanca, you'll make your way first into Roberta's lively, corrugated metal-facade, past the delicious smell of their wood-burning pizza oven and sound of vinyl records playing the blues, and through the buzzing outdoor garden. Can this many tattooed urbanites and Millennials know something you don't? Indeed. Blanca's interior is sleek and minimal, with a pristine white counter lined with cognac leather stools positioned to watch the chefs create each dish. Chef Carlo Mirarchi's nightly 20-course menu is never published beforehand, nor does the restaurant take any dietary accommodations into account. The message is loud and clear: trust us and we'll delight your senses. And delight it does as dinner might begin with deep orange lobes of sea urchin dusted with coarse sea salt and a tiny dollop of warm polenta. Then move on to impeccably fresh sliced fluke in almond water and plum vinegar, topped with fennel fronds; or tender ravioli fat with spicy 'nduja and laced with zesty grated orange.",11206,40.70492,-73.93354,112.5,2,0,0,0,0,0,0,0,0,0,0,0,0,0,0,0,0,0
Bar Corvo, Italian,"Walk by Bar Corvo and sense the goodness that awaits inside. A pane of glass provides a sneak peek at the large marble bar, communal table, penny-tile flooring, and cheerfully retro décor. Its eclectic vibe and artistic touches lead to a spacious garden, perfect for groups, and a culinary experience that keeps lines spilling onto the sidewalk. Here, a house-made aïoli adds a horseradish kick to sublimely tender beef tongue fries-braised in a chicken stock, tossed in a beer and rice-flour batter, and finally fried to perfection. The savory pesce al forno starts with a base of fingerling potatoes and continues with a lightly breaded fillet of hake, baked with cherry tomatoes, black olives, and finished with garlic and herb salmoriglio.",11238,40.6729,-73.96283,37.0,0,0,0,0,0,0,1,0,0,0,0,0,0,0,0,0,0,0
Gran Eléctrica, Mexican,"Looking to market ingredients and a California-style approach to Mexican cuisine, this chic yet comfortable restaurant impresses with its lovely décor and lively vibe. Servers are engaged and enthusiastic about the menu's pleasures. An ideal visit starts with a margarita at the bar and moves to the garden as strings of lights flicker to life. Mexico and Brooklyn are in balance on a menu that includes small plates such as memelitas de frijoles, a masa disc topped with mashed black beans, spicy salsa verde, queso fresco, and crema. Flavor is bright in the deliciously untraditional poblano chile relleno stuffed with Havarti, roasted tomato-jalapeño salsa, and tortillas. Try the frijoles de la olla (black beans topped with avocado) on the side.",11201,40.702526,-73.993034,37.0,0,1,0,0,0,0,1,0,0,0,0,0,0,0,0,0,0,0
Pok Pok Ny, Thai,"Foodies flock to this penultimate scene not for the vibe, but for a profound understanding of Isaan culinary traditions. If pok pok means ""mortar and pestle"" then Chef Andy Ricker makes this utensil the foundation of his trademark cooking, which takes excellent local product and imparts it with American flair. The spacious room, outfitted with salvaged wood and exposed brick walls, is filled with a Brooklyn crowd. The kitchen has struggled with turnover and while some dishes remain solid as ever, others can disappoint. Top-quality boar collar coated in a flavorful rub of soy sauce, sugar, and spice is seared to chewy perfection before being coupled with cool mustard greens. Superb execution and pronounced flavors are clear in khanom jiin kaeng khiaw waan luuk chin plae, a tart and texturally exquisite green coconut curry floating with delicate fish balls and garnished with fried anchovies for unbeatable texture; and sai ua samun phrai or grilled Thai sausage accompanied by a spicy eggplant sauce, crispy pork cracklings, and a bouquet of long beans. Seal the deal with affogato-a shot of espresso poured over decadent condensed milk ice cream, which ensures nothing but sweet dreams.",11231,40.687653,-74.001434,37.0,1,0,0,0,0,0,1,0,0,0,0,0,0,0,0,0,0,0
La Vara, Spanish,"Set in quiet and charming Cobble Hill, La Vara is as alluring as its surrounds. Inside, hip urbanites get down to business around the sleek marble bar; while stroller-rolling parents might migrate to curved leather booths or nestle in the wooden alcoves up front. In the main dining room, white tables set with contemporary crockery offer just the right contrast to rustic brick walls. From soft lighting and personable service, to countrified food and inventive presentations, this convivial respite never misses a beat. Embark on a journey to culinary heights with the visually strange but wonderful tasting remojón featuring a scoop of house-cured salt cod mingled with orange segments, pistachios, and sliced green olives. Then, sail on to fideuà or Valencian-style noodle paella tossed with fresh, briny clams, tender squid, and a creamy aïoli. With luck on your side, cochinillo (slow-cooked, amber-hued suckling pig with crackling skin and rose-quince sauce) or tortillita de gambas accompanied by a pale pink shrimp pâté may star on the menu. If not, rest easy as you can still have your cake (or in this case an orange blossom-scented walnut tart finished with lemon curd and cream) and eat it too.",11201,40.687737,-73.99557,37.0,1,0,0,0,0,0,1,0,0,0,0,0,0,0,0,0,0,0
M Shanghai, Chinese,"Look at the steamer full of luscious soup dumplings on just about every table in this notable Williamsburg Chinese café, and there should be little doubt of the best way to begin a meal here. Plump full of hot pork broth magically encased in scalloped wonton wrappers, they are sheer pleasure. Vegan and vegetarian treats include fried tofu with sweet peppers and black bean sauce; or cool, silken batons of eggplant salad dressed with plenty of garlic, soy, and a hint of sweetness. The scallion pancakes are fantastically large, hot, and shatteringly crisp wedges accompanied by a dipping sauce prepared tableside. The low-key room is accented by whitewashed brick walls, honey-toned bamboo slats, and ceiling lights fashioned out of birdcages.",11211,40.713017,-73.95756,18.5,0,0,0,0,0,0,1,0,0,0,0,0,0,0,0,0,0,0
Palo Santo, Latin American,"Jacques Gautier is the artiste behind this snug den cooking Latin and Caribbean cuisine. Nestled at the base of a townhouse, the dimly lit room makes for a lively (cue the salsa beats) yet intimate dining experience. Service can be slow, but nobody's in a hurry, so play along and make a night to remember. Closely set tables make privacy a challenge, but the arrival of crave-worthy pork tacos topped with creamy avocado, crunchy radish, and cilantro will keep your eyes on the prize. Find equal appeal in a fillet of roasted fluke set atop pickled purple cabbage, paired with a pineapple-habanero sauce that will make you singe with abandon, and scattered with tart tomatillo salsa. Still have room for more? Continue the feast across the street at Taco Santo.",11217,40.676952,-73.98185,37.0,0,0,0,0,0,0,1,0,0,0,0,0,0,0,0,0,0,0
Petit Oven, French,"Unassuming but worth your attention, this little Bay Ridge site offers a petite, tidy room that is simply done and fills quickly. The ambience here brings a gracious welcome, and the air wears a palpable note of authenticity. Chef/owner Katarzyna Ploszaj styles her agreeable and refreshingly relaxed cuisine through a classic French lens. Appetizers may include a novel riff on Greek salad composed of thinly shaved Brussels sprouts mingled with diced feta, a handful of black olives, sliced red onion, and a sprig of fragrant oregano all licked with olive oil and a bright hit of lemon juice. Expect equally impressive entreés like a cooked duck breast, crisped and rosy, with red onion-ginger marmalade, and duck fat-roasted potatoes scented with thyme.",11209,40.63584,-74.02639,37.0,0,0,0,0,0,0,0,0,0,0,0,0,0,0,0,0,0,0
Talde, Asian,"This corner of Park Slope is the domain of Chef Dale Talde, whose forte for cooking creative pan-Asian delights at glitzy hot spots has been astutely translated. Carved woodwork and figurines define this sexy venue that, by virtue of its location, is also family-friendly. His menu invokes the flavors of China, Japan, Thailand, Korea, as well as the Philippines. Wonton noodle soup is not to be missed: pork-and-chive dumplings poached in a rich, cloudy broth stocked with springy noodles, tender pork shoulder, wilted greens, and a six-minute egg. Miso-marinated salmon is plated with puffed bulgur, pickled plums, and salsa verde; while local corn is tossed with long beans and lemongrass-Kaffir lime butter for a light yet delightful bite.",11215,40.665604,-73.98266,37.0,0,0,0,0,0,0,0,0,0,0,0,0,0,0,0,0,0,0
Casa Enríque, Mexican,"Chiapas. Puebla. San Luis Potosí. One can literally taste the regions and cities that Chef Cosme Aguilar's amazingly complex menu explores-including his own childhood recipes to honor his mother's memory. A steady stream of hungry diners seeks out this rather small, tasteful dining room for friendly yet professional service and soul-warming fare. Aim for the large, fantastic communal table. Start your meal with hearty rajas con crema, combining none-too-spicy poblanos with sweet, fresh corn, Mexican sour cream, and cheese served alongside a stack of fresh and slightly toasty tortillas. This kitchen's tender chicken enchiladas with mole de Piaxtala may induce swooning, thanks to a sauce that is unexpectedly sweet yet heady with bitter chocolate, raisins, almonds, cloves, cinnamon, chilies, garlic, sesame, and so much more, with incomparable results. It's the kind of food that thrills palates (and tempts wanton thoughts). Expect the chamarros de borrego al huaxamole to arrive falling off the bone and redolent of epazote, allspice, and pulla chilies. Its fruity-spicy broth is drinkable. Every bit of every spongy and buttery layer of the cow and goat's milk pastel tres leches is absolutely worth the indulgence.",11101,40.743492,-73.95425,37.0,1,0,0,0,0,0,1,0,0,0,0,0,0,0,0,0,0,0
Piccola Venezia, Italian,"This old-time idol deserves its landmark status as it has been going strong since opening in 1973. With Italian-American cooking so rampant in the city, it's wholly refreshing to happen upon a classic of such welcoming comfort. The décor is outdated, but white tablecloths are clean and crisp, and glasses gleam at the prospect of great wine varietals. With a trio of pasta, you needn't choose between fusi swirled in a grappa- mushroom- and Grana-sauce; squid ink taglierini; or maltagliati in a roasted tomato and basil sauce with a touch of cream. Spiedini alla Romana sees thick slabs of focaccia and mozzarella dredged and fried, served with an anchovy and caper sauce, and pork osso buco is of the falling-apart-tender variety-perfect with the velvety polenta.",11103,40.76464,-73.91192,112.5,0,0,0,1,0,0,0,0,0,1,0,0,1,0,0,0,0,1
Wafa, Middle Eastern,"One cannot know the sheer joy and passion that goes into homemade Lebanese food without a visit to Wafa. Nestled among the mom-and-pop shops of Forest Hills' main strip, this pocket-sized spot appears shy on décor but bold on authenticity. The smiling owner, Wafa Chami, runs the kitchen and her falafel still ranks among the best in town-these perfect orbs of chickpeas and ""secret Wafa spices"" are stuffed in a fluffy pita with hummus, pickled turnips, and har hot sauce. Primo specials range from stuffed eggplant and zucchini, to ground lamb steeped in garlicky tomato sauce. Meat pies sound pedestrian but should be sampled-these light-as-air flatbreads are topped with minced beef, sautéed with onions, tomatoes, and her infamous spice mix.",11375,40.710804,-73.85303,37.0,0,0,0,0,0,0,0,0,0,0,0,1,0,0,0,0,0,0
Foragers City Table, Contemporary,"Chef Nickolas Martinez flaunts his pedigree with intensity at this homage to all things local and organic. The restaurant-cum-market is an offshoot of an independent grocer in DUMBO, though its kitchen philosophy seems to have arrived via California.Inside, the boxy dining room radiates functionality through large, unemcumbered windows and hardwood tables. It is staffed and patronized by the sort of local-loving sycophants who consider it an honor to dine here. And it actually is.Begin with Sfoglini trumpets generously bathed in a luxurious lamb Bolognese with tender broccoli rabe and earthy brown beech mushrooms. Unabashed spice tingles with every slurp of clear sweet shrimp- chicken- and herb-filled dumpling soup.",10011,40.74478,-73.99933,37.0,0,0,0,0,0,0,0,0,0,0,0,1,0,0,0,0,0,0
Sauce, Italian,"What would you expect from a spot called Sauce? Some serious and very delicious red sauce-naturally! Serving Italian-American comfort food with a nostalgic décor to match, Sauce stays modern with its local, hipster-friendly playlist, and quirky ambience-the attractive crowd doesn't hurt either. It's a fun meal to say the least. Pasta is made in-house daily, with specials that feature potato-kale gnocchi or the signature ricotta cavatelli showered with pecorino. The menu highlights regional specialties from Little Italys across the country, including SF's cioppino and classic Nuyorkese tomato gravy like nonna used to make. Try the robust Sergio Leone steak smothered in tomato sauce and topped with a fried heritage egg for tons of fun and flavor.",10002,40.72034,-73.989365,18.5,0,0,0,0,0,0,1,0,0,0,0,0,0,0,0,0,0,0
